{
  "$schema": "https://json-schema.org/draft/2020-12/schema",
  "$id": "https://mikilab.local/kicad-library/credentials.schema.json",
  "title": "MIKILAB fetch_components credentials",
  "description": "Credenziali e opzioni per scripts/fetch_components.py. Il file reale e' credentials.json nella radice della libreria (ignorato da git, permessi 600; oppure il percorso in $MIKILAB_CREDENTIALS). Si crea copiando credentials.example.json. Username vuoto o password '*******' = non impostato: il login si fa a mano nel browser.",
  "type": "object",
  "additionalProperties": false,
  "properties": {
    "$schema": {
      "type": "string"
    },
    "snapeda": {
      "$ref": "#/$defs/account",
      "description": "Account SnapEDA / SnapMagic Search (https://www.snapeda.com)."
    },
    "ultralibrarian": {
      "$ref": "#/$defs/account",
      "description": "Account Ultra Librarian (https://app.ultralibrarian.com)."
    },
    "easyeda": {
      "type": "object",
      "additionalProperties": false,
      "description": "JLCPCB/LCSC via EasyEDA (easyeda2kicad): non serve un account, usa il campo 'lcsc' della lista.",
      "properties": {
        "enabled": {
          "type": "boolean",
          "default": true,
          "description": "false = non usare questa sorgente."
        }
      }
    },
    "source_order": {
      "description": "Ordine in cui provare le sorgenti per ogni componente. Se la prima fornisce una parte incompleta (senza footprint) o con pin/pad non corrispondenti, si passa alla successiva.",
      "type": "array",
      "items": {
        "enum": [
          "snapeda",
          "ultralibrarian",
          "easyeda"
        ]
      },
      "uniqueItems": true,
      "minItems": 1,
      "default": [
        "snapeda",
        "ultralibrarian",
        "easyeda"
      ]
    },
    "download_dir": {
      "description": "Cartella dove vengono salvati (e cercati) gli zip scaricati: <download_dir>/<sorgente>/<NOME>.zip. Anche gli zip scaricati a mano direttamente in questa cartella vengono riconosciuti dal part number nel nome file.",
      "type": "string",
      "default": "~/Downloads/mikilab"
    },
    "browser_profile_dir": {
      "description": "Profilo persistente del browser automatizzato: i login (e gli eventuali captcha risolti a mano) restano validi tra un'esecuzione e l'altra.",
      "type": "string",
      "default": "~/.cache/mikilab/browser"
    },
    "headless": {
      "description": "true = browser invisibile. Con false (consigliato) si vede la finestra e si può completare a mano un passaggio (captcha, scelta formato, click su Download) se l'automazione non ci riesce.",
      "type": "boolean",
      "default": false
    },
    "download_timeout_seconds": {
      "description": "Quanto attendere, per ogni componente e sorgente, che parta un download (automatico o cliccato a mano).",
      "type": "integer",
      "minimum": 10,
      "default": 180
    },
    "delay_seconds": {
      "description": "Pausa tra un componente e il successivo, per non martellare i siti.",
      "type": "number",
      "minimum": 0,
      "default": 5
    },
    "componentvault": {
      "type": "object",
      "additionalProperties": false,
      "description": "Richieste KiCad di ComponentVault, senza server: scripts/fetch_worker.py legge le richieste dalla cartella condivisa scelta nell'app (Impostazioni > Cartella condivisa) e vi scrive esiti, zip KiCad e indice della libreria. Le credenziali dei fornitori restano solo in questo file.",
      "properties": {
        "shared_dir": {
          "type": "string",
          "description": "Percorso della cartella condivisa, es. ~/Library/Mobile Documents/com~apple~CloudDocs/ComponentVault",
          "default": ""
        },
        "library_name": {
          "type": "string",
          "maxLength": 64,
          "default": "MIKILAB",
          "description": "Nome della libreria mostrato nelle app (indice kicad/library_index.json). Nell'app si puo' sostituire in Impostazioni > Libreria KiCad."
        }
      }
    }
  },
  "$defs": {
    "account": {
      "type": "object",
      "additionalProperties": false,
      "required": [
        "username",
        "password"
      ],
      "properties": {
        "enabled": {
          "type": "boolean",
          "default": true,
          "description": "false = non usare questa sorgente."
        },
        "username": {
          "type": "string",
          "description": "Username o e-mail di login."
        },
        "password": {
          "type": "string"
        }
      },
      "description": "Preferibile: account nel Portachiavi di macOS (scripts/credentials_keychain.py set <sorgente>), che ha la precedenza; qui username vuoto e password '*******'."
    }
  }
}
