{
  "$schema": "./docs/credentials.schema.json",
  "snapeda": {
    "enabled": true,
    "username": "",
    "password": "*******"
  },
  "ultralibrarian": {
    "enabled": true,
    "username": "",
    "password": "*******"
  },
  "easyeda": {
    "enabled": true
  },
  "source_order": [
    "snapeda",
    "ultralibrarian",
    "easyeda"
  ],
  "download_dir": "~/Downloads/mikilab",
  "headless": false,
  "download_timeout_seconds": 180,
  "delay_seconds": 5,
  "componentvault": {
    "shared_dir": "",
    "library_name": "MIKILAB"
  }
}
